{
  "version": 2,
  "title": "Twinkle, Twinkle, Little Star",
  "composer": "Traditional · French melody, 18th century",
  "category": "melody",
  "tempo": 68,
  "timeSignature": "4/4",
  "events": [
    {
      "beats": 1,
      "right": {
        "notes": [
          {
            "pitch": "C4",
            "duration": 1
          }
        ]
      }
    },
    {
      "beats": 1,
      "right": {
        "notes": [
          {
            "pitch": "C4",
            "duration": 1
          }
        ]
      }
    },
    {
      "beats": 1,
      "right": {
        "notes": [
          {
            "pitch": "G4",
            "duration": 1
          }
        ]
      }
    },
    {
      "beats": 1,
      "right": {
        "notes": [
          {
            "pitch": "G4",
            "duration": 1
          }
        ]
      }
    },
    {
      "beats": 1,
      "right": {
        "notes": [
          {
            "pitch": "A4",
            "duration": 1
          }
        ]
      }
    },
    {
      "beats": 1,
      "right": {
        "notes": [
          {
            "pitch": "A4",
            "duration": 1
          }
        ]
      }
    },
    {
      "beats": 2,
      "right": {
        "notes": [
          {
            "pitch": "G4",
            "duration": 2
          }
        ]
      }
    },
    {
      "beats": 1,
      "right": {
        "notes": [
          {
            "pitch": "F4",
            "duration": 1
          }
        ]
      }
    },
    {
      "beats": 1,
      "right": {
        "notes": [
          {
            "pitch": "F4",
            "duration": 1
          }
        ]
      }
    },
    {
      "beats": 1,
      "right": {
        "notes": [
          {
            "pitch": "E4",
            "duration": 1
          }
        ]
      }
    },
    {
      "beats": 1,
      "right": {
        "notes": [
          {
            "pitch": "E4",
            "duration": 1
          }
        ]
      }
    },
    {
      "beats": 1,
      "right": {
        "notes": [
          {
            "pitch": "D4",
            "duration": 1
          }
        ]
      }
    },
    {
      "beats": 1,
      "right": {
        "notes": [
          {
            "pitch": "D4",
            "duration": 1
          }
        ]
      }
    },
    {
      "beats": 2,
      "right": {
        "notes": [
          {
            "pitch": "C4",
            "duration": 2
          }
        ]
      }
    },
    {
      "beats": 1,
      "right": {
        "notes": [
          {
            "pitch": "G4",
            "duration": 1
          }
        ]
      }
    },
    {
      "beats": 1,
      "right": {
        "notes": [
          {
            "pitch": "G4",
            "duration": 1
          }
        ]
      }
    },
    {
      "beats": 1,
      "right": {
        "notes": [
          {
            "pitch": "F4",
            "duration": 1
          }
        ]
      }
    },
    {
      "beats": 1,
      "right": {
        "notes": [
          {
            "pitch": "F4",
            "duration": 1
          }
        ]
      }
    },
    {
      "beats": 1,
      "right": {
        "notes": [
          {
            "pitch": "E4",
            "duration": 1
          }
        ]
      }
    },
    {
      "beats": 1,
      "right": {
        "notes": [
          {
            "pitch": "E4",
            "duration": 1
          }
        ]
      }
    },
    {
      "beats": 2,
      "right": {
        "notes": [
          {
            "pitch": "D4",
            "duration": 2
          }
        ]
      }
    },
    {
      "beats": 1,
      "right": {
        "notes": [
          {
            "pitch": "G4",
            "duration": 1
          }
        ]
      }
    },
    {
      "beats": 1,
      "right": {
        "notes": [
          {
            "pitch": "G4",
            "duration": 1
          }
        ]
      }
    },
    {
      "beats": 1,
      "right": {
        "notes": [
          {
            "pitch": "F4",
            "duration": 1
          }
        ]
      }
    },
    {
      "beats": 1,
      "right": {
        "notes": [
          {
            "pitch": "F4",
            "duration": 1
          }
        ]
      }
    },
    {
      "beats": 1,
      "right": {
        "notes": [
          {
            "pitch": "E4",
            "duration": 1
          }
        ]
      }
    },
    {
      "beats": 1,
      "right": {
        "notes": [
          {
            "pitch": "E4",
            "duration": 1
          }
        ]
      }
    },
    {
      "beats": 2,
      "right": {
        "notes": [
          {
            "pitch": "D4",
            "duration": 2
          }
        ]
      }
    },
    {
      "beats": 1,
      "right": {
        "notes": [
          {
            "pitch": "C4",
            "duration": 1
          }
        ]
      }
    },
    {
      "beats": 1,
      "right": {
        "notes": [
          {
            "pitch": "C4",
            "duration": 1
          }
        ]
      }
    },
    {
      "beats": 1,
      "right": {
        "notes": [
          {
            "pitch": "G4",
            "duration": 1
          }
        ]
      }
    },
    {
      "beats": 1,
      "right": {
        "notes": [
          {
            "pitch": "G4",
            "duration": 1
          }
        ]
      }
    },
    {
      "beats": 1,
      "right": {
        "notes": [
          {
            "pitch": "A4",
            "duration": 1
          }
        ]
      }
    },
    {
      "beats": 1,
      "right": {
        "notes": [
          {
            "pitch": "A4",
            "duration": 1
          }
        ]
      }
    },
    {
      "beats": 2,
      "right": {
        "notes": [
          {
            "pitch": "G4",
            "duration": 2
          }
        ]
      }
    },
    {
      "beats": 1,
      "right": {
        "notes": [
          {
            "pitch": "F4",
            "duration": 1
          }
        ]
      }
    },
    {
      "beats": 1,
      "right": {
        "notes": [
          {
            "pitch": "F4",
            "duration": 1
          }
        ]
      }
    },
    {
      "beats": 1,
      "right": {
        "notes": [
          {
            "pitch": "E4",
            "duration": 1
          }
        ]
      }
    },
    {
      "beats": 1,
      "right": {
        "notes": [
          {
            "pitch": "E4",
            "duration": 1
          }
        ]
      }
    },
    {
      "beats": 1,
      "right": {
        "notes": [
          {
            "pitch": "D4",
            "duration": 1
          }
        ]
      }
    },
    {
      "beats": 1,
      "right": {
        "notes": [
          {
            "pitch": "D4",
            "duration": 1
          }
        ]
      }
    },
    {
      "beats": 2,
      "right": {
        "notes": [
          {
            "pitch": "C4",
            "duration": 2
          }
        ]
      }
    }
  ]
}
