{
  "version": 2,
  "title": "Mary Had a Little Lamb",
  "composer": "Traditional · 19th-century melody",
  "category": "melody",
  "tempo": 76,
  "timeSignature": "4/4",
  "events": [
    {
      "beats": 1,
      "right": {
        "notes": [
          {
            "pitch": "E4",
            "duration": 1
          }
        ]
      }
    },
    {
      "beats": 1,
      "right": {
        "notes": [
          {
            "pitch": "D4",
            "duration": 1
          }
        ]
      }
    },
    {
      "beats": 1,
      "right": {
        "notes": [
          {
            "pitch": "C4",
            "duration": 1
          }
        ]
      }
    },
    {
      "beats": 1,
      "right": {
        "notes": [
          {
            "pitch": "D4",
            "duration": 1
          }
        ]
      }
    },
    {
      "beats": 1,
      "right": {
        "notes": [
          {
            "pitch": "E4",
            "duration": 1
          }
        ]
      }
    },
    {
      "beats": 1,
      "right": {
        "notes": [
          {
            "pitch": "E4",
            "duration": 1
          }
        ]
      }
    },
    {
      "beats": 2,
      "right": {
        "notes": [
          {
            "pitch": "E4",
            "duration": 2
          }
        ]
      }
    },
    {
      "beats": 1,
      "right": {
        "notes": [
          {
            "pitch": "D4",
            "duration": 1
          }
        ]
      }
    },
    {
      "beats": 1,
      "right": {
        "notes": [
          {
            "pitch": "D4",
            "duration": 1
          }
        ]
      }
    },
    {
      "beats": 2,
      "right": {
        "notes": [
          {
            "pitch": "D4",
            "duration": 2
          }
        ]
      }
    },
    {
      "beats": 1,
      "right": {
        "notes": [
          {
            "pitch": "E4",
            "duration": 1
          }
        ]
      }
    },
    {
      "beats": 1,
      "right": {
        "notes": [
          {
            "pitch": "G4",
            "duration": 1
          }
        ]
      }
    },
    {
      "beats": 2,
      "right": {
        "notes": [
          {
            "pitch": "G4",
            "duration": 2
          }
        ]
      }
    },
    {
      "beats": 1,
      "right": {
        "notes": [
          {
            "pitch": "E4",
            "duration": 1
          }
        ]
      }
    },
    {
      "beats": 1,
      "right": {
        "notes": [
          {
            "pitch": "D4",
            "duration": 1
          }
        ]
      }
    },
    {
      "beats": 1,
      "right": {
        "notes": [
          {
            "pitch": "C4",
            "duration": 1
          }
        ]
      }
    },
    {
      "beats": 1,
      "right": {
        "notes": [
          {
            "pitch": "D4",
            "duration": 1
          }
        ]
      }
    },
    {
      "beats": 1,
      "right": {
        "notes": [
          {
            "pitch": "E4",
            "duration": 1
          }
        ]
      }
    },
    {
      "beats": 1,
      "right": {
        "notes": [
          {
            "pitch": "E4",
            "duration": 1
          }
        ]
      }
    },
    {
      "beats": 1,
      "right": {
        "notes": [
          {
            "pitch": "E4",
            "duration": 1
          }
        ]
      }
    },
    {
      "beats": 1,
      "right": {
        "notes": [
          {
            "pitch": "E4",
            "duration": 1
          }
        ]
      }
    },
    {
      "beats": 1,
      "right": {
        "notes": [
          {
            "pitch": "D4",
            "duration": 1
          }
        ]
      }
    },
    {
      "beats": 1,
      "right": {
        "notes": [
          {
            "pitch": "D4",
            "duration": 1
          }
        ]
      }
    },
    {
      "beats": 1,
      "right": {
        "notes": [
          {
            "pitch": "E4",
            "duration": 1
          }
        ]
      }
    },
    {
      "beats": 1,
      "right": {
        "notes": [
          {
            "pitch": "D4",
            "duration": 1
          }
        ]
      }
    },
    {
      "beats": 4,
      "right": {
        "notes": [
          {
            "pitch": "C4",
            "duration": 4
          }
        ]
      }
    }
  ]
}
